arg-id,comment-id,argument
A895949104118808577_0,895949104118808577,米沢市はもともと「米沢織」という織物業が盛んな土地で、化学繊維企業の帝人は競争相手として米沢から追い出された。
A895949220342976512_0,895949220342976512,地方の残念エピソードが面白いので、どこかでまとめたい。
A895952063498117120_0,895952063498117120,日本人は西洋から多くのものを取り入れるが、常に上から下への流れであり、欧米のように下から上に波及することがない。この違いが日本の独特な文化や問題の源泉になっていると感じる。
A896034816541343746_0,896034816541343746,サークルクラッシュの話をしていた。
A896034816541343746_1,896034816541343746,千葉遠征のLTをしていた。
A896034816541343746_2,896034816541343746,コミケのコスプレ写真を漁っていた。
A896041205791825920_0,896041205791825920,1年ごとに100人ずつ人口が減る村は興味深い。
A896042648426786817_0,896042648426786817,廃校が多く余っているので、一つ引き受けて強力な生徒会ごっこをやりたい。
A1557909368448090112_0,1557909368448090112,@kurybon_jin824 コロッケ！！
A764040767115366400_0,764040767115366400,フランスのテレビ解説者が体操日本女子を「ピカチュウみたい」と表現し、批判を受けて「人種差別ではない」と釈明した。
A764052399572946944_0,764052399572946944,Prime Videoでポケモンを見ていると、早朝にポケモンを見るために毎日早起きしていた頃を思い出す。
A764052399572946944_1,764052399572946944,19年後、サトシは依然としてポケモンマスターになれず、僕は東京の路上で寝泊まりしている。泣ける。
A1558056545761755141_0,1558056545761755141,@kou19960409 見逃した〜〜〜！がんばれ〜！
A1558067067319771136_0,1558067067319771136,Pogostuck Map3感動の最終回 part 2: https://t.co/GofajI9v9P
A1558133267609427969_0,1558133267609427969,ここ数日Map3に挑戦中！べるか先生 @BeLka_jp が優しく見守ってくれています。
A1425982316795502595_0,1425982316795502595,#RingFitAdventure #NintendoSwitch https://t.co/nZ0Vv5yLVr
A1426008441382871045_0,1426008441382871045,人間の役に立つために生きるだけが人間ではないと思う。
A1426032276949798919_0,1426032276949798919,岩波がこのタイミングで『ちゃんとした心理学を学ぼう』と書籍を紹介するのは面白い。
A1426120523902193664_0,1426120523902193664,蚊に刺されて非常にイライラしている。
A1426120863074512899_0,1426120863074512899,全員始末できたかな。
A1426122201380446210_0,1426122201380446210,もう1匹いるわ…
A1426198135643074567_0,1426198135643074567,今日はエキスパート4。マスターに上がれなかった。
A1426198135643074567_1,1426198135643074567,お盆も休みなしなので、明日の夜に頑張りたい。
A1426198802726199301_0,1426198802726199301,配信しないと無口で、配信をすると汚い言葉が出るのは、本来逆ではないか。
A1426199437236269058_0,1426199437236269058,カイリキーの投げ技はblinkも吸い込むので、早めに対処する必要がある。
A1426199939399311361_0,1426199939399311361,サンダーファイト前にサレンダーする人のモチベーションが理解できない。
A1426199939399311361_1,1426199939399311361,このゲームは最後の問題で1兆点が出るクイズ番組で、lolのようにだらだら続かず、きっちり10分で終わるからだ。
A1426200410914627585_0,1426200410914627585,エースバーンは、優勢劣勢に関わらず、最終盤にピークを迎え、全員を倒してサンダーを取って勝つことができる。
A1426200410914627585_1,1426200410914627585,ポケモンユナイトの知識はまだ少ないが、LoLのADC経験で勝てる。
A1426201156515078147_0,1426201156515078147,中央に向かう途中で上下のゴールが壊れていないことに気づかずミスをした。前に味方が同じミスをして腹が立ったが、自分も同じことをしてしまった。
A1426201156515078147_1,1426201156515078147,取得後に殺されない最短ルートを計算しつつ、上下どちらかのゴールが壊れるだろうという予測が外れるとミスが起こる。やはりマップをしっかり確認する必要がある。特に時間ギリギリのときは注意が必要だ。
A1426201393824632837_0,1426201393824632837,明日ログインでようやくゲッコウガを手に入れる。ナーフが入る前に使ってみたい。
A1426201502117371909_0,1426201502117371909,ゲッコウガは非常に強力で、味方にいないだけで不利になるレベルである。
A1426202609203912708_0,1426202609203912708,マスターに到達できるかと思ったけど、マスターに行かないとこのゲームは地獄だ。
A1426204958425157633_0,1426204958425157633,現在のメタでは、ゲッコウガにジャングルを任せるのが最適である。
A1426204958425157633_1,1426204958425157633,レーンエスバは序盤にスティールを狙い、レベルを先行させる必要がある。
A632024525828308992_0,632024525828308992,クソみたいな署名をいかにして排除するかが鍵だと思う。
A632101513138036736_0,632101513138036736,調子が悪い。
A1824282965960167709_0,1824282965960167709,お盆の大半を使ってドラゴンボール超を見終えた。😭
A1824296389775327282_0,1824296389775327282,電気工事士試験に合格しました！やったー！😄
A1824296391738290281_0,1824296391738290281,電気工事士試験に合格しました！やったー！😄
A1824300571706491383_0,1824300571706491383,@M_ocoC 次は狩猟免許だ！
A1824300631705944109_0,1824300631705944109,@sanbongazin やったぜ！
A1824300648541917635_0,1824300648541917635,@ku3uyo いえーい！！
A1162265229645926400_0,1162265229645926400,怠け行動を研究して、自分の言い訳を見つけたい。
A1162267934355365889_0,1162267934355365889,影響力のある科学者のフォロワー数が少ないことに驚く。
A1162292213344165890_0,1162292213344165890,義憤は進化の産物である。
A1824384066747240846_0,1824384066747240846,@Lasuuto_DB_Z 🫡
A1824384113761194000_0,1824384113761194000,@with_naricoman ありがとう〜！
A1824410050791977131_0,1824410050791977131,@Lasuuto_DB_Z なんか受かってた😀
A1162335933724647426_0,1162335933724647426,高校生物をやり直すなら、検定教科書を見てみるのが良いかもしれない。
A1162335933724647426_1,1162335933724647426,それなら高校に入学するのが良いのではないか。
A1030261659946770432_0,1030261659946770432,RT @todesking: いい話 https://t.co/17bKOxGpzv
A1030269367815229441_0,1030269367815229441,"回収しに来た (at @Apple Sendai Ichibancho in 仙台市, 宮城県)"
A1030274925674868736_0,1030274925674868736,"抗えない (@ 餃子の王将 in 仙台市, 宮城県) https://t.co/FXZxRW9bAc"
A1030279539698544640_0,1030279539698544640,修理に出したMacを回収しに行った際、Apple Storeの店員が「学生さんで毎日授業で使ってるとかですか？」と世間話をしてきた。
A1030279539698544640_1,1030279539698544640,「いえ、無職です」と他の客の前で答えることになり、申し訳ない気持ちになった。
A1030283421287895040_0,1030283421287895040,"スクフェスACはとても難しい (@ 仙台レジャーランド 一番町店 - @sendai111 in 仙台市, 宮城県) https://t.co/pWk8aK3v6W"
A1030291742355083264_0,1030291742355083264,"とうとうパンツを買った (at @montbellJp in 仙台市, 宮城県) https://t.co/3y9cqU0nJ4"
A1030314919038615552_0,1030314919038615552,"本を読んでいる (@光禅台公園 in 仙台市, 宮城県) https://t.co/CHEUhVTUUR"
A1030315479804469248_0,1030315479804469248,「とりあえず3年」という表現は世鏡抄が起源なのか？
A1030316965510828032_0,1030316965510828032,キュアアンジュの衣装を試着しました。娘が『ママ、アンジュの服かわいく作れてすごいなぁ、うれしい！』と言ってくれました。長いこと待たせてごめんね。ついに池袋フレフレワールド来週参戦！楽しみです。
A1030325081048633344_0,1030325081048633344,一揆の原理を読んだ。
A1030329505036943360_0,1030329505036943360,河合隼雄の著作を読む。
A1030336987922755584_0,1030336987922755584,広島修道大学の学生の皆さん、暗黒卿の集中講義楽しみですね!
A1030337078305808385_0,1030337078305808385,現役生はずるい！
A1030343936068530177_0,1030343936068530177,"臭いオタクしてます (at @animateSendai in 仙台市, 宮城県)"
A1030363768881012741_0,1030363768881012741,https://t.co/dihAhqVgSx
A1030395583373107201_0,1030395583373107201,RT @kouki_izumi: しかるねこ、しかるねこ（CV:上坂すみれ）になった途端あんだけ馬鹿にしてたヲタクが手のひら返しで「しかるねこ？ かわいいよね。前から好きだった」みたいな顔して普通にRTしまくってるので、小池百合子（CV:池澤春菜）や森喜朗（CV:田村ゆかり）と…
A1030409331559165954_0,1030409331559165954,河合隼雄が「愛し合ってる2人が結ばれれば幸福になれるという危険思想にだけは陥るなよ」と言っていて好感が持てる。
A1030463604657545216_0,1030463604657545216,@cloneko おめでとうございます！
A1030463650371235846_0,1030463650371235846,RT @yuruhuwa_kdenpa: ツイのオタクじゃん #となりのトトロ https://t.co/uSd9msRbK2
A1030465326943629312_0,1030465326943629312,寒すぎ注意報
A1030493188182560770_0,1030493188182560770,クマ動画よりも、道路で人間が揉める動画の方がドキドキするかもしれない。
A1030493278813081602_0,1030493278813081602,RT @brothertoki: シャンプーかきました 例のチャイナ水着 https://t.co/LfRxGOmmGu
A898347491518697472_0,898347491518697472,"休憩中。都内で筋肉が悲鳴をあげていた。 (@ ファミリーマート 越谷南荻島北店 - @famima_now in Koshigaya, Saitama) https://t.co/ubO55Tx4qA"
A898360226814013442_0,898360226814013442,道の駅にたまらず駆け込んだ。
A898362188615737344_0,898362188615737344,断固として動きたくない。
A898363858938601472_0,898363858938601472,日が差していたら都内で死んでいたかもしれない。
A898393984405446656_0,898393984405446656,"何キロかぶりにコンビニがあった (@ セブンイレブン 古河北利根工業団地店 in 古河市, 茨城県)"
A898409842695471108_0,898409842695471108,@sakamata はい、しんどい。
A898410794626367490_0,898410794626367490,神社の駐車場で怒られるまで横になる。
A898411296902660097_0,898411296902660097,@sakamata 今70キロ地点で横になっていますが、晴れていたら危険でしたね。
A898413216794951681_0,898413216794951681,@takuzirra 今回はつくばを通らず、宇都宮方面に行きます。
A898426132017463301_0,898426132017463301,"本日の風呂 (@ みつば 湯楽院 in 小山市, 栃木県) https://t.co/SFrABfcA2c"
A898442539614715905_0,898442539614715905,風呂ではサウナ後に掛水しない人が多く、民度が低いと感じた。
A898442539614715905_1,898442539614715905,二階にリクライニングチェア、座敷、漫画があり、かなり良い。
A898445410724749312_0,898445410724749312,1日50キロ前後の運動をして、早い時間からスーパー銭湯を楽しみたい。
A898448603437387777_0,898448603437387777,長距離ランニングで、腰や腕、足が痛い。
A898450259646349312_0,898450259646349312,輪行袋はあるが、荷物が多いため輪行しても大変なので、ゆっくり向かうしかない。
A898450799285518336_0,898450799285518336,人口が増加し続けている小山市についての情報はこちら: 小山市 - Wikipedia https://t.co/QhrzNP0JAF
A898455145217900549_0,898455145217900549,国道4号線は側道があり走りやすいが、田んぼばかりで飽きる。
A898458799182237696_0,898458799182237696,RT @Hadou_DX: ほたこま付き合ってる時空のほたるんの好みを知り尽くしてるこまちゃん先輩 https://t.co/iy2co96Iiz
A898459232613277696_0,898459232613277696,支援をお願いします。種延がお風呂に入れます。お金ください。 #polca
A1692451591927087327_0,1692451591927087327,寝間着のまま会社に行ったら、そろそろドレスコードを導入するかという話になった。😇
A898460729958727680_0,898460729958727680,運動していない引きこもりは、初めてのロングラン前日に過度な自慰行為を避けるべきである。
A898460964193845248_0,898460964193845248,男湯におばちゃんスタッフがいるのはいいけど、笑わないでほしい。😭
A898461264908738560_0,898461264908738560,ドキュメンタルの春日のカレーライスやうな重を射出するシーン、俺もできる自信がある。
A898463020178735104_0,898463020178735104,夜までスーパー銭湯でリラックスする予定です。
A898463020178735104_1,898463020178735104,自転車が盗まれるかもしれないけど、その場合は電車で大船渡に直行するのもありかなと思っています。
A898463323288555520_0,898463323288555520,シェアハウスでは器物損壊、家宅捜索、家賃不払い、住民トラブル、警察や救急の呼び出し、乱交、戦闘、不法投棄、自殺などが発生することがある。
A898463812394770432_0,898463812394770432,異常者はマナーに気配りするのが難しいため、ルール化すべきである。
A898464700173664256_0,898464700173664256,心理学を学んでいる人は、シェアハウスに住むことで間近で観察できるので良い。
A898465777967276032_0,898465777967276032,明文化されたルールを守ることで安心が担保されるべきである。
A898466149649727488_0,898466149649727488,更新していないサイトをHTTPS化するのは無意味である。
A898468295589810176_0,898468295589810176,腕よりもケツが重篤である。
A898470787262304261_0,898470787262304261,鼻毛が気になる。
A898475396554829824_0,898475396554829824,味噌汁をこぼした。
A898480635588694016_0,898480635588694016,若い活力を持て余した15人ほどの少年たち
A898480635588694016_1,898480635588694016,ロバを獣姦した少年たち、次々と狂犬病に | ニコニコニュース (20 users) https://t.co/8x2UQfMaV4
A898496526896332802_0,898496526896332802,お金持ちになったらスーパー銭湯で暮らしたい。
A1692489150761779336_0,1692489150761779336,お祝いが届くと頑張る気持ちが湧いてきます！ありがとうございます。個別にお礼を送ります。
A1692508632091631698_0,1692508632091631698,トイレにいた幼虫はガの幼虫かもしれない。
A898553906707406853_0,898553906707406853,"郊外のコインランドリーで良心を感じる (@ マンマチャオ結城店 in 結城市, 茨城県) https://t.co/4eWqnzmawM"
A898557562307485696_0,898557562307485696,チャリ旅はしんどいと思っていたが、全然知らない街にいるのは面白い。
A898558376497430532_0,898558376497430532,福山で聞いた500円でやらせてくれるワンコインババアは、駅での寸借詐欺とナンパ待ちビッチが融合して誕生した怪異と推測される。
A898558764847988736_0,898558764847988736,どこでも寝れると思ったが、藪が近いと蛇が怖いので街中の公園に限る。
A898565232108457985_0,898565232108457985,"寝る。雨が強くなってきた。 (@ けやき(南部中央)公園 in 結城市, 茨城県) https://t.co/Aq8bT7T1lm"
A898568652538093570_0,898568652538093570,蚊がつらいが、テントを張りたくない。
A898633823763681280_0,898633823763681280,蚊だけならそのうち寝れるが、雷雨で目と耳が刺激され、皮膚もいじめられると人は寝れないという学び。
A898656409855840256_0,898656409855840256,"雨が降っているので待機中 (@ マクドナルド 50号結城バイパス店 - @mcdonaldsjapan in 結城市, 茨城県) https://t.co/HtVLb8iRzI"
A898667258045583360_0,898667258045583360,「よっこいしょういち」「そうはいかんざき」「しまったしまった島倉千代子」が口癖の女の子
A898668204410548225_0,898668204410548225,300m先の個室ビデオ店をスルーできるかが、今日の行程の全てを決する。
A898669431953526785_0,898669431953526785,びっちょびちょで出発 https://t.co/IVOn31Ux0g https://t.co/yhFzK1CsdT
A898681727853264896_0,898681727853264896,強い雨雲が進行方向と一致している。
A898682695999381504_0,898682695999381504,滝のような雨に打たれている無職に500円ください。 #polca
A898683270258348033_0,898683270258348033,まさかの個室ビデオ店が正解だったとは驚きだ。
A898684512699207680_0,898684512699207680,ツインテール美少女の気分でコーヒーをドリップする装備はあるが、雨で湿気が多くてコーヒーを買えない。
A898685393167458304_0,898685393167458304,下野市（しもつけし）という名前がエッチに聞こえる。
A898688028788506624_0,898688028788506624,ガイド本では夕張が紹介されておらず、ネット上でしか情報が得られない。
A898688028788506624_1,898688028788506624,夕張の観光地は廃止や休館が多く、空き屋と廃墟が目立つ。
A898690008269205506_0,898690008269205506,雨雲レーダーを信じて9時にスタートするのが良いかもしれない。
A898690534805393408_0,898690534805393408,polcaは、意識高い乞食という批判を受けることがある。
A766426112213725184_0,766426112213725184,「コミュニケーション能力」という言葉は、グローバルな異文化理解能力と日本特有の空気を読む能力の両方を求めている。
A766426890038939652_0,766426890038939652,レスリングの吉田さんが取材料でマスコミのヘイトを集めているため、粘着され続ける可能性がある。
A766428770123165696_0,766428770123165696,JR北海道は石勝線夕張支線を2019年春にも廃止する予定である。
A766445891045593089_0,766445891045593089,ついに俺のポケモンが終わったぞ…。国内限定142種図鑑コンプリートしました。 #ポケモンGo
A766448655976968193_0,766448655976968193,死者は決して蘇らないという戒め。
A766448655976968193_1,766448655976968193,プログラマ必見！死にかけたサービスを劇的に蘇らせて日本一にする方法（0円グロースハック） - Qiita (519 users) https://t.co/V5PXjWhzeP
A766527413262045185_0,766527413262045185,コンビニのイートインに大きな蜂がいて、回転率が上がりそう。
A766529749522931712_0,766529749522931712,消費の停滞を懸念するなら、若者世代ではなくお金を持っている世代からどうやって回収するかを考えるべきだと思う。
A1560522481097908225_0,1560522481097908225,#きょったん寿司食ったか https://t.co/Bmfy86gpuH
A1560558067741528064_0,1560558067741528064,お父様のご快復をお祈りしています。
A1560558139074019329_0,1560558139074019329,@abrikosyyukari あつい！！！
A1560562933515825157_0,1560562933515825157,@KYOKA_S 中身はマグロか何かでした。
A766571493522223104_0,766571493522223104,Twitterサービス終了と聞いて
A766571493522223104_1,766571493522223104,Twitterが低品質なツイートを通知タイムラインから排除する「クオリティフィルター」を追加した。
A766583587650928640_0,766583587650928640,Drumiの発売が2017年夏に延期された。 https://t.co/he76KvCjly
A766586803356786688_0,766586803356786688,【ポケモンGoの進捗】国内図鑑142種類コンプリートした - razokulover publog (133 users) https://t.co/kTjVkWrSGl
A1560581232001290240_0,1560581232001290240,単位取れてたー
A766589518971404288_0,766589518971404288,貧困層同士が争っているのを高所得層が見物しているのは風情がある。
A766589518971404288_1,766589518971404288,NHKが貧困報道で捏造をしたという件がよくわからない。
A1560585813720649730_0,1560585813720649730,大学の科目登録をしてからPogo
A1560657577137958917_0,1560657577137958917,今日は初めてギロチンと対面しました！さすがに死なないですよね！！！ https://t.co/oaEQuI9XWd
A1560658049555042304_0,1560658049555042304,らんらんさん @ranpigJP、レイドありがとうございました！
A1560658049555042304_1,1560658049555042304,「な～んてこった」が好きでよく真似しちゃってごめんなさい🤣
A1560658049555042304_2,1560658049555042304,Map3の4分切りチャレンジが3分30秒台で凄まじい進捗でした！ポゴレジェまったなし！！
A1560658049555042304_3,1560658049555042304,https://t.co/hicGP6EwxH
A1560658617627381760_0,1560658617627381760,わんちゃん @one_leaf623 レイドありがとう！今日はキーケース作りを頑張ってたみたいですね。疲れた手をPogoで癒しましょう。オンラインショップもチェックしてね！
A1560659291735879680_0,1560659291735879680,今日はあっちょさん @atcho999 に初めてレイドさせていただきました！
A1560659291735879680_1,1560659291735879680,Map1最終回配信中で、緑や紫の怖い人達に混じって応援しました。
A1560659291735879680_2,1560659291735879680,牙突破ガンバです！
A1560659972207153153_0,1560659972207153153,おいでよMap2 https://t.co/pfRj2nmaIn
A766769189147160576_0,766769189147160576,酒は飲まなくなった。
A766769189147160576_1,766769189147160576,酒を飲むようになった - phaの日記 (61 users) https://t.co/wsTAnuf0y9
A1428635049897857026_0,1428635049897857026,つるはしで採掘労働していたら壊れて、まるでマインクラフトのようだった。
A1428698391773515781_0,1428698391773515781,レーンも集団戦もすべて弱い。
A1428698391773515781_1,1428698391773515781,trollが2試合に1回湧くようになったので、文句なしに魔境だ。
A1428720734537322503_0,1428720734537322503,怒りのパワーで絶対に殺すマンになった。
A1428720734537322503_1,1428720734537322503,レベル優位を取ったときのニトロチャージが強力だ。
A634534991750426624_0,634534991750426624,クリエイティブ業務に関わる皆さまへ、有料写真の無断使用は著作権侵害となり、勝訴事例があります。
A634535941336637441_0,634535941336637441,被告が弁護士事務所であることに驚いた。
A634567425237741568_0,634567425237741568,この人の言っている深くはまりすぎることは、オタク気質とは別のものだと思う。
A634572140516274176_0,634572140516274176,産廃女子のコンテンツ力が高い。
A634575074956152832_0,634575074956152832,@sanpaijyoshi 転職する前にフリーで色々試してみてほしい。面白そう。
A634576095359053824_0,634576095359053824,@sanpaijyoshi 僕もWeb目指して上京しましたが、色々な場所に顔を出していたら仕事が次々と舞い込んできて、就職する必要がないと感じました。失業保険期間中は色々と遊び回るのが良いと思います。
A634576095359053824_1,634576095359053824,産廃女子というストーリーがとても面白いので、ウケそうです。
A634628680786907136_0,634628680786907136,男女で正礼装に差があると感じる。
A634670469023559680_0,634670469023559680,ブラックサンダーは美味しい。
A634674410633359360_0,634674410633359360,深夜に家にいられない事情を持つ子供は珍しくない。母親が知らない男を家に連れ込む場合や、アルコール依存症の父親に殴られるから避難している子供もいる。家出しなければ家族や地域社会の誰かにレイプされ続ける危険にさらされている子供もいる。
A634674782328328192_0,634674782328328192,これはすごい！ダイソーの「ピローまくら」で作った「おっぱい」が優秀すぎる。
A634681435614412800_0,634681435614412800,藁草履を作りたい。
A634682053250801664_0,634682053250801664,都内近郊で藁草履を教えてくれる場所や人を探しています。
A634682182741569536_0,634682182741569536,小学校のときに作ったことがあるが、忘れてしまった。
A634701957752487938_0,634701957752487938,MarkdownでEvernoteを書くことができるツール“Marxico”についてのコメント。VimやEmacsのキーバインドも設定可能。
A634717024975884289_0,634717024975884289,地震
A634743132605689856_0,634743132605689856,『おもひでぽろぽろ』を見る。
A634774381298884608_0,634774381298884608,『おもひでぽろぽろ』は、大人になってから見ると想像以上に面白い。凄まじい映画だ。
A1164695427578359808_0,1164695427578359808,ポパーは実際に人から批判されると非常に怒ったという話が好き。
A1164695876935155712_0,1164695876935155712,RT @bRylle_x: #threesome 😬😳🤔 https://t.co/pVLcdzyv5H
A1164713261738029056_0,1164713261738029056,花粉症は自己責任である。
A1164713487752257536_0,1164713487752257536,N国が次に「杉の木をぶっ壊す！」と言い出したら支持を得そう。
